{
  "ticker": "NVDA",
  "name": "NVIDIA Corporation",
  "status": "STRATEGY_CONFIRMED_ACCUMULATING",
  "strategy_snapshot": {
    "topology": "AI 时代的物理总线，CUDA 软件生态护城河。",
    "primary_vector": "Blackwell 架构爆发，B200 芯片供不应求。",
    "fragile_point": "供应链产能瓶颈及超高预期下的业绩容错率低。"
  },
  "execution_protocol": {
    "entry_rules": {
      "initial_tranche_pct": 0.008,
      "current_price_baseline": 208.27
    },
    "add_rules": {
      "catalyst": "Blackwell 量产进度及云服务商资本开支确认",
      "limit": "Max weight 3.0%",
      "tranches": [
        {
          "price": 201.50,
          "weight_step": 0.012,
          "priority": "MEDIUM",
          "reason": "均线回踩及估值合理化"
        },
        {
          "price": 188.00,
          "weight_step": 0.01,
          "priority": "HIGH",
          "reason": "回补缺口及强支撑确认"
        }
      ]
    },
    "take_profit_rules": {
      "fundamental_tp": 265.00,
      "trailing_stop_pct": 8.0
    },
    "stop_loss_rules": {
      "technical_sl": 175.00,
      "fundamental_melt_down": "Blackwell 架构出现重大设计缺陷或核心客户订单削减",
      "macro_kill_switch": "系统性芯片出口禁令或 AI 算力泡沫确认破裂"
    }
  },
  "risk_metrics": {
    "purity_score": 0.95,
    "concentration_risk": "HIGH (AI Sector Beta)",
    "valuation_anchor": "Growth-adjusted PE (PEG) < 1.0"
  },
  "last_updated": "2026-04-26T12:25:00Z"
}