{
  "ticker": "AVGO",
  "name": "Broadcom Inc.",
  "status": "ACTIVE_MONITORING",
  "strategy_snapshot": {
    "topology": "Custom Silicon Utility (TPU v7/v8) + Networking Fabric (Tomahawk/Jericho) + VMware Infrastructure",
    "primary_vector": "Hyperscale ASIC co-design dominance (Google 2031 extension) vs Nvidia TCO arbitrage",
    "fragile_point": "Oligopsony Concentration (Google dependency) + 2nm/3nm Fab capacity (TSMC)"
  },
  "execution_protocol": {
    "entry_rules": {
      "initial_tranche_pct": 0.40,
      "entry_zone": [370.00, 380.00],
      "current_price_baseline": 379.75,
      "confirmation_event": "Q2 2026 Earnings (June 2026) + VMware Margin Data"
    },
    "add_rules": {
      "catalyst": "Anthropic/Frontier model diversification (Path 2) or TP > $345.00 support retest",
      "limit": "Max total weight 0.50"
    },
    "take_profit_rules": {
      "fundamental_tp": 450.00,
      "trailing_stop_pct": 0.08
    },
    "stop_loss_rules": {
      "technical_sl": 328.00,
      "fundamental_melt_down": "Google TPU partnership shift or >15% reduction in TPU CAPEX",
      "macro_kill_switch": "Data center power delays (>2 quarters) or TSMC 2nm yield failure"
    }
  },
  "risk_metrics": {
    "purity_score": 0.435,
    "concentration_risk": "HIGH (Google >75% of ASIC Rev)",
    "valuation_anchor": "PE 21.2 (Current) -> 28.0 (Target)"
  },
  "last_updated": "2026-04-14T11:00:00Z"
}
